{
  "schema_version": "1.0.0",
  "transaction_id": "TR-SMD-0000001",
  "run_id": "run-0001",
  "created_at": "2026-06-09T00:00:00Z",
  "created_by": null,
  "source_manifest_hash": null,
  "payload": {
    "workflow_state": "intake",
    "source_files": [
      {
        "original_path": "C:\\incoming\\plan.pdf",
        "copied_path": "D:\\cases\\TR-SMD-0000001\\source\\plan.pdf",
        "file_type": ".pdf",
        "file_size": 12345,
        "copied_at": "2026-06-09T00:00:00Z",
        "source_role": null
      }
    ],
    "detected_profile": {
      "profile_code": "scenario_b",
      "display_label": "Scenario B - points/computation + DWG + plan/map reference",
      "status": "matched",
      "detected_at": "2026-06-09T00:00:00Z",
      "missing_roles": [],
      "issues": []
    }
  },
  "warnings": [],
  "errors": []
}
